<?xml version="1.0"?>
<xs:schema xmlns:xs="http://www.w3.org/2001/XMLSchema">

    <xs:element name="infected">
        <xs:complexType>
            <xs:sequence>
                <xs:element name="person" minOccurs="0" maxOccurs="unbounded">
                    <xs:complexType>
                        <xs:sequence>
                            <xs:element name="id">
                                <xs:simpleType>
                                    <xs:restriction base="xs:integer">
                                        <xs:minInclusive value="1" />
                                        <xs:maxInclusive value="1000" />
                                    </xs:restriction>
                                </xs:simpleType>
                            </xs:element>

                            <xs:element name="fname" type="xs:string" />
                            <xs:element name="lname" type="xs:string" />
                            <xs:element name="age" type="xs:float" />
                            <xs:element name="location" type="xs:string" />

                            <xs:element name="sex">
                                <xs:simpleType>
                                    <xs:restriction base="xs:string">
                                        <xs:enumeration value="male" />
                                        <xs:enumeration value="female" />
                                    </xs:restriction>
                                </xs:simpleType>
                            </xs:element>

                            <xs:element name="birthdate">
                                <xs:simpleType>
                                    <xs:restriction base="xs:string">
                                        <xs:pattern value="(0[1-9]|[12][0-9]|3[01]).(0[1-9]|1[012]).(19|20)\d\d" />
                                    </xs:restriction>
                                </xs:simpleType>
                            </xs:element>

                            <xs:element name="education" type="xs:string" />
                            <xs:element name="description" type="xs:string" />

                            <xs:element name="images">
                                <xs:complexType>
                                    <xs:sequence>
                                        <!-- Type should be base64Binary -->
                                        <xs:element name="image" type="xs:string" minOccurs="1" maxOccurs="unbounded" />
                                    </xs:sequence>
                                </xs:complexType>
                            </xs:element>

                            <xs:element name="infection-rate">
                                <xs:simpleType>
                                    <xs:restriction base="xs:integer">
                                        <xs:minInclusive value="1" />
                                        <xs:maxInclusive value="10" />
                                    </xs:restriction>
                                </xs:simpleType>
                            </xs:element>
                        </xs:sequence>
                    </xs:complexType>
                </xs:element>
            </xs:sequence>
        </xs:complexType>
    </xs:element>

</xs:schema>