<?xml version="1.0" encoding="UTF-8" standalone="no"?>
<infected xmlns:xsi="http://www.w3.org/2001/XMLSchema-instance" xsi:noNamespaceSchemaLocation="./schema.xsd">
    <person>
        <id>1</id>
        <fname>a</fname>
        <lname>a</lname>
        <age>21</age>
        <location>a</location>
        <sex>female</sex>
        <birthdate>01.01.2001</birthdate>
        <education>College</education>
        <description>Sick and ill</description>
        <images>
            <image>image1.png</image>
            <image>image2.png</image>
        </images>
        <infection-rate>1</infection-rate>
    </person>
    <person>
        <id>2</id>
        <fname>b</fname>
        <lname>b</lname>
        <age>22</age>
        <location>b</location>
        <sex>male</sex>
        <birthdate>01.01.2002</birthdate>
        <education>College</education>
        <description>Sick and ill</description>
        <images>
            <image>image1.png</image>
            <image>image2.png</image>
        </images>
        <infection-rate>2</infection-rate>
    </person>
    <person>
        <id>4</id>
        <fname>d</fname>
        <lname>d</lname>
        <age>24</age>
        <location>d</location>
        <sex>male</sex>
        <birthdate>01.01.2004</birthdate>
        <education>College</education>
        <description>Sick and ill</description>
        <images>
            <image>image1.png</image>
            <image>image2.png</image>
        </images>
        <infection-rate>4</infection-rate>
    </person>
    <person>
        <id>5</id>
        <fname>e</fname>
        <lname>e</lname>
        <age>25</age>
        <location>e</location>
        <sex>female</sex>
        <birthdate>01.01.2005</birthdate>
        <education>College</education>
        <description>Sick and ill</description>
        <images>
            <image>image1.png</image>
            <image>image2.png</image>
        </images>
        <infection-rate>5</infection-rate>
    </person>
    <person>
        <id>1</id>
        <fname>a</fname>
        <lname>a</lname>
        <age>21</age>
        <location>a</location>
        <sex>female</sex>
        <birthdate>01.01.2001</birthdate>
        <education>College</education>
        <description>Sick and ill</description>
        <images>
            <image>image1.png</image>
            <image>image2.png</image>
        </images>
        <infection-rate>1</infection-rate>
    </person>
    <person>
        <id>2</id>
        <fname>b</fname>
        <lname>b</lname>
        <age>22</age>
        <location>b</location>
        <sex>male</sex>
        <birthdate>01.01.2002</birthdate>
        <education>College</education>
        <description>Sick and ill</description>
        <images>
            <image>image1.png</image>
            <image>image2.png</image>
        </images>
        <infection-rate>2</infection-rate>
    </person>
    <person>
        <id>4</id>
        <fname>d</fname>
        <lname>d</lname>
        <age>24</age>
        <location>d</location>
        <sex>male</sex>
        <birthdate>01.01.2004</birthdate>
        <education>College</education>
        <description>Sick and ill</description>
        <images>
            <image>image1.png</image>
            <image>image2.png</image>
        </images>
        <infection-rate>4</infection-rate>
    </person>
    <person>
        <id>5</id>
        <fname>e</fname>
        <lname>e</lname>
        <age>25</age>
        <location>e</location>
        <sex>female</sex>
        <birthdate>01.01.2005</birthdate>
        <education>College</education>
        <description>Sick and ill</description>
        <images>
            <image>image1.png</image>
            <image>image2.png</image>
        </images>
        <infection-rate>5</infection-rate>
    </person>
</infected>